{
  "schema_version": 1,
  "slug": "paper-c",
  "level": 1,
  "existence": "verified",
  "resolved_by": "crossref",
  "query": {
    "kind": "title",
    "value": "Label noise between annotation sources"
  },
  "identifiers": {
    "doi": "10.5555/wayline.fixture.paper-c"
  },
  "metadata": {
    "title": "Label noise between annotation sources",
    "year": 2019
  },
  "created": "2026-09-11T20:00:00.000Z",
  "relation_to_intent": "Bears on whether interaction terms help on tabular data.",
  "deserves_l2_if": "A spec claim rests on its method."
}
